PMID,Title,Authors,Year,Journal,PMCID,DOI,Suggested Filename
41481100,The Predictive Power of Intraoperative EEG and Clinical Characteristics for Postoperative Delirium Following Cardiac Surgery.,"Wiredu K, Sun H, Boncompte G, Westover MB, Pedemonte JC, Akeju O",2026,,,10.1097/WNP.0000000000001146,2026_Wiredu_Unknown_41481100.pdf
41448621,Clinical Manifestations.,"Leng Y, He Y, Amini S, Magdamo CG, Paschalidis I, Mukerji S, Moura LMV, Westover MB, Vranceanu AM, Ritchie CS, Blacker D, Dickson JR, Das S",2025,,,10.1002/alz70857_107622,2025_Leng_Unknown_41448621.pdf
40237584,Association of Time to Continuous EEG Initiation With Outcomes in Critically Ill Patients.,"Haider MA, Khalil MH, Fernandes MB, Westover MB, Zafar SF",2025,,,10.1097/WNP.0000000000001161,2025_Haider_Unknown_40237584.pdf
41330044,Automated estimation of frequency and spatial extent of periodic and rhythmic epileptiform activity from continuous electroencephalography data.,"Tăuțan AM, Jing J, Basovic L, Hadar PN, Sartipi S, Fernandes MP, Kim J, Struck AF, Westover MB, Zafar SF",2025,,,10.1088/1741-2552/ae2716,2025_Tuan_Unknown_41330044.pdf
39820182,Electroencephalography in Clinical Practice: Neurology Professionals' Views on Optimal Standards of Care.,"Nascimento FA, Katyal R, Kass NR, Yuan D, Sirven JI, Westover MB, Beniczky S",2025,,,10.1097/WNP.0000000000001142,2025_Nascimento_Unknown_39820182.pdf
41034682,Real-World Antiseizure Medication Prophylaxis and Outcomes in Hospitalized Adults with Acute Brain Injuries.,"Cheng D, Fernandes MB, Westover MB, Moura L, Zafar SF",2025,,,10.1007/s12028-025-02345-7,2025_Cheng_Unknown_41034682.pdf
